{
  "$schema": "./compatibility.schema.json",
  "schemaVersion": 1,
  "baseline": {
    "verifiedOn": "2026-10-08",
    "structurizrVersion": "6.2.3",
    "structurizrCommit": "529efa8",
    "dslArtifact": "com.structurizr:structurizr-dsl:6.2.3",
    "langiumVersion": "4.4.0",
    "nodeVersion": "22 LTS (tested with 22.14.0)",
    "vscodeApi": "1.140",
    "lspProtocol": "3.18"
  },
  "statusModel": [
    "not-applicable",
    "not-started",
    "recognized",
    "partial",
    "tested",
    "verified"
  ],
  "features": [
    {
      "id": "workspace",
      "documentation": "https://docs.structurizr.com/dsl/language#workspace",
      "syntax": "tested",
      "semanticAnalysis": "partial",
      "multiFile": "tested",
      "officialParity": "not-started",
      "rendering": "not-applicable",
      "tests": ["packages/language/test/grammar.test.ts"]
    },
    {
      "id": "workspace-extends",
      "documentation": "https://docs.structurizr.com/dsl/language#workspace",
      "syntax": "recognized",
      "semanticAnalysis": "not-started",
      "multiFile": "not-started",
      "officialParity": "not-started",
      "rendering": "not-applicable",
      "tests": []
    },
    {
      "id": "model",
      "documentation": "https://docs.structurizr.com/dsl/language#model",
      "syntax": "tested",
      "semanticAnalysis": "partial",
      "multiFile": "tested",
      "officialParity": "not-started",
      "rendering": "not-applicable",
      "tests": ["packages/language/test/grammar.test.ts"]
    },
    {
      "id": "archetypes",
      "documentation": "https://docs.structurizr.com/dsl/language#archetypes",
      "syntax": "not-started",
      "semanticAnalysis": "not-started",
      "multiFile": "not-applicable",
      "officialParity": "not-started",
      "rendering": "not-applicable",
      "tests": []
    },
    {
      "id": "group",
      "documentation": "https://docs.structurizr.com/dsl/language#group",
      "syntax": "recognized",
      "semanticAnalysis": "partial",
      "multiFile": "not-started",
      "officialParity": "not-started",
      "rendering": "not-applicable",
      "tests": []
    },
    {
      "id": "person",
      "documentation": "https://docs.structurizr.com/dsl/language#person",
      "syntax": "tested",
      "semanticAnalysis": "partial",
      "multiFile": "tested",
      "officialParity": "not-started",
      "rendering": "not-started",
      "tests": ["packages/language/test/grammar.test.ts"]
    },
    {
      "id": "software-system",
      "documentation": "https://docs.structurizr.com/dsl/language#softwareSystem",
      "syntax": "tested",
      "semanticAnalysis": "partial",
      "multiFile": "tested",
      "officialParity": "not-started",
      "rendering": "not-started",
      "tests": ["packages/language/test/grammar.test.ts"]
    },
    {
      "id": "container",
      "documentation": "https://docs.structurizr.com/dsl/language#container",
      "syntax": "tested",
      "semanticAnalysis": "partial",
      "multiFile": "tested",
      "officialParity": "not-started",
      "rendering": "not-started",
      "tests": ["packages/language/test/grammar.test.ts"]
    },
    {
      "id": "component",
      "documentation": "https://docs.structurizr.com/dsl/language#component",
      "syntax": "recognized",
      "semanticAnalysis": "partial",
      "multiFile": "not-started",
      "officialParity": "not-started",
      "rendering": "not-started",
      "tests": []
    },
    {
      "id": "deployment-environment",
      "documentation": "https://docs.structurizr.com/dsl/language#deploymentEnvironment",
      "syntax": "recognized",
      "semanticAnalysis": "partial",
      "multiFile": "not-started",
      "officialParity": "not-started",
      "rendering": "not-started",
      "tests": []
    },
    {
      "id": "deployment-group",
      "documentation": "https://docs.structurizr.com/dsl/language#deploymentGroup",
      "syntax": "recognized",
      "semanticAnalysis": "not-started",
      "multiFile": "not-started",
      "officialParity": "not-started",
      "rendering": "not-started",
      "tests": []
    },
    {
      "id": "deployment-node",
      "documentation": "https://docs.structurizr.com/dsl/language#deploymentNode",
      "syntax": "recognized",
      "semanticAnalysis": "partial",
      "multiFile": "not-started",
      "officialParity": "not-started",
      "rendering": "not-started",
      "tests": []
    },
    {
      "id": "infrastructure-node",
      "documentation": "https://docs.structurizr.com/dsl/language#infrastructureNode",
      "syntax": "recognized",
      "semanticAnalysis": "partial",
      "multiFile": "not-started",
      "officialParity": "not-started",
      "rendering": "not-started",
      "tests": []
    },
    {
      "id": "software-system-instance",
      "documentation": "https://docs.structurizr.com/dsl/language#softwareSystemInstance",
      "syntax": "recognized",
      "semanticAnalysis": "partial",
      "multiFile": "not-started",
      "officialParity": "not-started",
      "rendering": "not-started",
      "tests": []
    },
    {
      "id": "container-instance",
      "documentation": "https://docs.structurizr.com/dsl/language#containerInstance",
      "syntax": "recognized",
      "semanticAnalysis": "partial",
      "multiFile": "not-started",
      "officialParity": "not-started",
      "rendering": "not-started",
      "tests": []
    },
    {
      "id": "instance-of",
      "documentation": "https://docs.structurizr.com/dsl/language#instanceOf",
      "syntax": "recognized",
      "semanticAnalysis": "partial",
      "multiFile": "not-started",
      "officialParity": "not-started",
      "rendering": "not-started",
      "tests": []
    },
    {
      "id": "health-check",
      "documentation": "https://docs.structurizr.com/dsl/language#healthCheck",
      "syntax": "recognized",
      "semanticAnalysis": "not-started",
      "multiFile": "not-applicable",
      "officialParity": "not-started",
      "rendering": "not-started",
      "tests": []
    },
    {
      "id": "custom-element",
      "documentation": "https://docs.structurizr.com/dsl/language#element",
      "syntax": "recognized",
      "semanticAnalysis": "partial",
      "multiFile": "not-started",
      "officialParity": "not-started",
      "rendering": "not-started",
      "tests": []
    },
    {
      "id": "relationship",
      "documentation": "https://docs.structurizr.com/dsl/language#relationship",
      "syntax": "tested",
      "semanticAnalysis": "partial",
      "multiFile": "tested",
      "officialParity": "not-started",
      "rendering": "not-started",
      "tests": ["packages/language/test/grammar.test.ts"]
    },
    {
      "id": "remove-relationship",
      "documentation": "https://docs.structurizr.com/dsl/language#remove-relationship",
      "syntax": "recognized",
      "semanticAnalysis": "not-started",
      "multiFile": "not-started",
      "officialParity": "not-started",
      "rendering": "not-applicable",
      "tests": []
    },
    {
      "id": "relationship-archetype-operator",
      "documentation": "https://docs.structurizr.com/dsl/archetypes",
      "syntax": "recognized",
      "semanticAnalysis": "not-started",
      "multiFile": "not-applicable",
      "officialParity": "not-started",
      "rendering": "not-started",
      "tests": []
    },
    {
      "id": "tag-and-tags",
      "documentation": "https://docs.structurizr.com/dsl/language#tags",
      "syntax": "recognized",
      "semanticAnalysis": "not-started",
      "multiFile": "not-applicable",
      "officialParity": "not-started",
      "rendering": "not-started",
      "tests": []
    },
    {
      "id": "element-description",
      "documentation": "https://docs.structurizr.com/dsl/language#description",
      "syntax": "recognized",
      "semanticAnalysis": "not-started",
      "multiFile": "not-applicable",
      "officialParity": "not-started",
      "rendering": "not-started",
      "tests": []
    },
    {
      "id": "technology",
      "documentation": "https://docs.structurizr.com/dsl/language#technology",
      "syntax": "recognized",
      "semanticAnalysis": "not-started",
      "multiFile": "not-applicable",
      "officialParity": "not-started",
      "rendering": "not-started",
      "tests": []
    },
    {
      "id": "instances",
      "documentation": "https://docs.structurizr.com/dsl/language#instances",
      "syntax": "recognized",
      "semanticAnalysis": "not-started",
      "multiFile": "not-applicable",
      "officialParity": "not-started",
      "rendering": "not-started",
      "tests": []
    },
    {
      "id": "url",
      "documentation": "https://docs.structurizr.com/dsl/language#url",
      "syntax": "recognized",
      "semanticAnalysis": "not-started",
      "multiFile": "not-applicable",
      "officialParity": "not-started",
      "rendering": "not-started",
      "tests": []
    },
    {
      "id": "properties",
      "documentation": "https://docs.structurizr.com/dsl/language#properties",
      "syntax": "recognized",
      "semanticAnalysis": "not-started",
      "multiFile": "not-applicable",
      "officialParity": "not-started",
      "rendering": "not-started",
      "tests": []
    },
    {
      "id": "perspectives",
      "documentation": "https://docs.structurizr.com/dsl/language#perspectives",
      "syntax": "recognized",
      "semanticAnalysis": "not-started",
      "multiFile": "not-applicable",
      "officialParity": "not-started",
      "rendering": "not-started",
      "tests": []
    },
    {
      "id": "element-modification",
      "documentation": "https://docs.structurizr.com/dsl/language#element",
      "syntax": "not-started",
      "semanticAnalysis": "not-started",
      "multiFile": "not-started",
      "officialParity": "not-started",
      "rendering": "not-applicable",
      "tests": [],
      "notes": "Covers !element."
    },
    {